reference,verse,answer,difficulty
Proverbs 3:5,"Trust in the LORD with all your ___, and do not lean on your own understanding.",heart,easy
John 3:16,"For God so loved the world that he gave his only Son, that whoever believes in him should not perish but have eternal ___.",life,easy
Psalm 23:1,"The LORD is my shepherd; I shall not ___.",want,easy
Philippians 4:13,"I can do all things through him who strengthens ___.",me,medium
Matthew 5:9,"Blessed are the peacemakers, for they shall be called sons of ___.",God,medium
Romans 12:12,"Rejoice in hope, be patient in tribulation, be constant in ___.",prayer,medium
Hebrews 11:1,"Now faith is the assurance of things hoped for, the conviction of things not ___.",seen,hard
Isaiah 40:31,"But they who wait for the LORD shall renew their strength; they shall mount up with wings like ___; they shall run and not be weary; they shall walk and not faint.",eagles,hard
James 1:5,"If any of you lacks wisdom, let him ask God, who gives generously to all without ___.",reproach,hard
